{
  "version": 1,
  "sources": {
    "template": {
      "repo": "I-Synergy/AI",
      "ref": "2026.11030.11923",
      "resolve": "remote"
    },
    "awesome-copilot": {
      "repo": "github/awesome-copilot",
      "ref": "main",
      "resolve": "remote",
      "license": "MIT"
    },
    "aspire-skills": {
      "repo": "microsoft/aspire-skills",
      "ref": "main",
      "resolve": "remote",
      "license": "MIT"
    },
    "dotnet-maui": {
      "repo": "dotnet/maui-labs",
      "ref": "main",
      "resolve": "remote",
      "license": "MIT",
      "paths": {
        "skill": [
          "plugins/dotnet-maui/skills"
        ],
        "agent": [
          ".github/agents"
        ],
        "instruction": [
          ".github/instructions"
        ],
        "plugin": [],
        "hook": []
      }
    },
    "dotnet-maui-tooling": {
      "repo": "dotnet/maui-labs",
      "ref": "main",
      "resolve": "remote",
      "license": "MIT",
      "paths": {
        "skill": [
          "plugins/dotnet-maui-tooling/skills"
        ],
        "agent": [],
        "instruction": [],
        "plugin": [],
        "hook": []
      }
    }
  },
  "skills": [
    "api-endpoints",
    "api-security",
    "architect",
    "blazor-fluentui",
    "blazor-specialist",
    "blazor-theme-generator",
    "code-reviewer",
    "council",
    "css-theme-generator",
    "database-migration",
    "devops-engineer",
    "dotnet-engineer",
    "gap-review",
    "integration-specialist",
    "maui-apple-design",
    "maui-blazor",
    "maui-specialist",
    "mobile-release",
    "performance-engineer",
    "playwright-tester",
    "refactor",
    "security",
    "skill-creator",
    "software-security",
    "solution-generator",
    "technical-writer",
    "ubiquitous-language",
    "ui-blazor",
    "ui-core",
    "ui-maui",
    "ui-uwp",
    "ui-winui",
    "ui-wpf",
    "unit-tester",
    "sync-platforms",
    "upgrade-template",
    "usecase-specification",
    "user-story",
    "verify-config",
    "vertical-slices",
    "winui-specialist",
    "xaml-theme-generator"
  ],
  "agents": [
    "architect",
    "designer",
    "developer",
    "reviewer",
    "security",
    "tester",
    "ui-developer",
    "ui-tester",
    "writer"
  ],
  "instructions": [
    "sonarqube_mcp"
  ],
  "plugins": [],
  "hooks": [],
  "materialize": "copy",
  "exclude": [],
  "prompts": [
    "create-readme",
    "create-unittest",
    "csharp-async",
    "documentation-writer",
    "dotnet-best-practices",
    "dotnet-design-pattern-review",
    "folder-structure-blueprint-generator",
    "iso-5055-quality-enforcer",
    "prompt-builder",
    "update-markdown-file-index",
    "usecases-gherkin-specs"
  ]
}
